{
  "schema_version": "originagent.evolution.evidence_report.v1",
  "module_digest": "aaaaaaaaaaaaaaaaaaaaaaaaaaaaaaaaaaaaaaaaaaaaaaaaaaaaaaaaaaaaaaaa",
  "proof_bundle_hash": "cb18c111559d1102a7e30d5e8af1ea4f31307ad790f3edf81d6882d90e8ad56e",
  "report_hash": "a95192ee916aebc5d8b8f5e0a0e043e693b1d493475e9bdd55872eeb3f8e663c",
  "evidence_type": "validator_report",
  "reporter": "0x7777777777777777777777777777777777777777",
  "operator_group_hash": "3333333333333333333333333333333333333333333333333333333333333333",
  "runner_fingerprint_hash": "4444444444444444444444444444444444444444444444444444444444444444",
  "challenge_window_end": 1893456000,
  "report_status": "active",
  "testnet_only": true,
  "external_validator_artifact_hash": "eeeeeeeeeeeeeeeeeeeeeeeeeeeeeeeeeeeeeeeeeeeeeeeeeeeeeeeeeeeeeeee"
}
