{
  "schema_version": "originagent.evolution.evidence_report.v1",
  "module_digest": "aaaaaaaaaaaaaaaaaaaaaaaaaaaaaaaaaaaaaaaaaaaaaaaaaaaaaaaaaaaaaaaa",
  "proof_bundle_hash": "cb18c111559d1102a7e30d5e8af1ea4f31307ad790f3edf81d6882d90e8ad56e",
  "report_hash": "2b517d681fb728bf05da53e4a79f53005968476affe5cb239cdedaf4a46a53bc",
  "evidence_type": "validator_report",
  "reporter": "0x6666666666666666666666666666666666666666",
  "operator_group_hash": "1111111111111111111111111111111111111111111111111111111111111111",
  "runner_fingerprint_hash": "2222222222222222222222222222222222222222222222222222222222222222",
  "challenge_window_end": 1893456000,
  "report_status": "active",
  "testnet_only": true,
  "external_validator_artifact_hash": "ffffffffffffffffffffffffffffffffffffffffffffffffffffffffffffffff"
}
